[{"schema_version": "gms.skill-artifact-ref.v1", "lineage_id": "sg-kind-drift", "version": 4, "kind": "step_guidance", "artifact_digest": "sha256:1278914212739342520741875f88aa85493080650dc00bf6c37a200766b39fe1"}, {"schema_version": "gms.skill-artifact-ref.v1", "lineage_id": "sg-kind-drift", "version": 4, "kind": "human_procedure", "artifact_digest": "sha256:1278914212739342520741875f88aa85493080650dc00bf6c37a200766b39fe1"}]
